GEO.id,GEO.id2,GEO.display-label,NAICS.id,NAICS.display-label,YEAR.id,ESTAB,EMP,PAYQTR1,PAYANN
0500000US29055,29055,"Crawford County, Missouri",62311,Nursing care facilities (skilled nursing facilities),2013,6,269,1180,5292
0500000US29055,29055,"Crawford County, Missouri",623110,Nursing care facilities (skilled nursing facilities),2013,6,269,1180,5292
0500000US29055,29055,"Crawford County, Missouri",6233,Continuing care retirement communities and assisted living facilities for the elderly,2013,4,b,D,D
0500000US29055,29055,"Crawford County, Missouri",62331,Continuing care retirement communities and assisted living facilities for the elderly,2013,4,b,D,D
0500000US29055,29055,"Crawford County, Missouri",623311,Continuing care retirement communities,2013,1,b,D,D
0500000US29055,29055,"Crawford County, Missouri",623312,Assisted living facilities for the elderly,2013,3,a,D,D
0500000US29055,29055,"Crawford County, Missouri",624,Social assistance,2013,48,106,294,1044
0500000US29055,29055,"Crawford County, Missouri",6241,Individual and family services,2013,39,b,114,390
0500000US29055,29055,"Crawford County, Missouri",62411,Child and youth services,2013,1,a,D,D
0500000US29055,29055,"Crawford County, Missouri",624110,Child and youth services,2013,1,a,D,D
0500000US29055,29055,"Crawford County, Missouri",62412,Services for the elderly and persons with disabilities,2013,32,49,110,375
0500000US29055,29055,"Crawford County, Missouri",624120,Services for the elderly and persons with disabilities,2013,32,49,110,375
0500000US29055,29055,"Crawford County, Missouri",62419,Other individual and family services,2013,6,a,D,D
0500000US29055,29055,"Crawford County, Missouri",624190,Other individual and family services,2013,6,a,D,D
0500000US29055,29055,"Crawford County, Missouri",6242,"Community food and housing, and emergency and other relief services",2013,2,a,D,D
0500000US29055,29055,"Crawford County, Missouri",62421,Community food services,2013,1,a,D,D
0500000US29055,29055,"Crawford County, Missouri",624210,Community food services,2013,1,a,D,D
0500000US29055,29055,"Crawford County, Missouri",62423,Emergency and other relief services,2013,1,a,D,D
0500000US29055,29055,"Crawford County, Missouri",624230,Emergency and other relief services,2013,1,a,D,D
0500000US29055,29055,"Crawford County, Missouri",6244,Child day care services,2013,7,49,171,604
0500000US29055,29055,"Crawford County, Missouri",62441,Child day care services,2013,7,49,171,604
0500000US29055,29055,"Crawford County, Missouri",624410,Child day care services,2013,7,49,171,604
0500000US29055,29055,"Crawford County, Missouri",71,"Arts, entertainment, and recreation",2013,8,56,209,960
0500000US29055,29055,"Crawford County, Missouri",711,"Performing arts, spectator sports, and related industries",2013,2,a,D,D
0500000US29055,29055,"Crawford County, Missouri",7113,"Promoters of performing arts, sports, and similar events",2013,1,a,D,D
0500000US29055,29055,"Crawford County, Missouri",71132,"Promoters of performing arts, sports, and similar events without facilities",2013,1,a,D,D
0500000US29055,29055,"Crawford County, Missouri",711320,"Promoters of performing arts, sports, and similar events without facilities",2013,1,a,D,D
0500000US29055,29055,"Crawford County, Missouri",7115,"Independent artists, writers, and performers",2013,1,a,D,D
0500000US29055,29055,"Crawford County, Missouri",71151,"Independent artists, writers, and performers",2013,1,a,D,D
0500000US29055,29055,"Crawford County, Missouri",711510,"Independent artists, writers, and performers",2013,1,a,D,D
0500000US29055,29055,"Crawford County, Missouri",713,"Amusement, gambling, and recreation industries",2013,6,41,193,835
0500000US29055,29055,"Crawford County, Missouri",7139,Other amusement and recreation industries,2013,6,41,193,835
0500000US29055,29055,"Crawford County, Missouri",71391,Golf courses and country clubs,2013,1,a,D,D
0500000US29055,29055,"Crawford County, Missouri",713910,Golf courses and country clubs,2013,1,a,D,D
0500000US29055,29055,"Crawford County, Missouri",71394,Fitness and recreational sports centers,2013,2,a,D,D
0500000US29055,29055,"Crawford County, Missouri",713940,Fitness and recreational sports centers,2013,2,a,D,D
0500000US29055,29055,"Crawford County, Missouri",71395,Bowling centers,2013,1,a,D,D
0500000US29055,29055,"Crawford County, Missouri",713950,Bowling centers,2013,1,a,D,D
0500000US29055,29055,"Crawford County, Missouri",71399,All other amusement and recreation industries,2013,2,b,D,D
0500000US29055,29055,"Crawford County, Missouri",713990,All other amusement and recreation industries,2013,2,b,D,D
0500000US29055,29055,"Crawford County, Missouri",72,Accommodation and food services,2013,58,483,1324,7291
0500000US29055,29055,"Crawford County, Missouri",721,Accommodation,2013,17,66,223,2148
0500000US29055,29055,"Crawford County, Missouri",7211,Traveler accommodation,2013,9,b,S,1229
0500000US29055,29055,"Crawford County, Missouri",72111,Hotels (except casino hotels) and motels,2013,6,23,75,640
0500000US29055,29055,"Crawford County, Missouri",721110,Hotels (except casino hotels) and motels,2013,6,23,75,640
0500000US29055,29055,"Crawford County, Missouri",72119,Other traveler accommodation,2013,3,a,D,D
0500000US29055,29055,"Crawford County, Missouri",721199,All other traveler accommodation,2013,3,a,D,D
0500000US29055,29055,"Crawford County, Missouri",7212,RV (recreational vehicle) parks and recreational camps,2013,7,23,63,908
0500000US29055,29055,"Crawford County, Missouri",72121,RV (recreational vehicle) parks and recreational camps,2013,7,23,63,908
0500000US29055,29055,"Crawford County, Missouri",721211,RV (recreational vehicle) parks and campgrounds,2013,5,21,61,816
0500000US29055,29055,"Crawford County, Missouri",721214,Recreational and vacation camps (except campgrounds),2013,2,a,D,D
0500000US29055,29055,"Crawford County, Missouri",7213,Rooming and boarding houses,2013,1,a,D,D
0500000US29055,29055,"Crawford County, Missouri",72131,Rooming and boarding houses,2013,1,a,D,D
0500000US29055,29055,"Crawford County, Missouri",721310,Rooming and boarding houses,2013,1,a,D,D
0500000US29055,29055,"Crawford County, Missouri",722,Food services and drinking places,2013,41,417,1101,5143
0500000US29055,29055,"Crawford County, Missouri",7223,Special food services,2013,3,28,77,259
0500000US29055,29055,"Crawford County, Missouri",72231,Food service contractors,2013,3,28,77,259
0500000US29055,29055,"Crawford County, Missouri",722310,Food service contractors,2013,3,28,77,259
0500000US29055,29055,"Crawford County, Missouri",7224,Drinking places (alcoholic beverages),2013,3,b,D,D
0500000US29055,29055,"Crawford County, Missouri",72241,Drinking places (alcoholic beverages),2013,3,b,D,D
0500000US29055,29055,"Crawford County, Missouri",722410,Drinking places (alcoholic beverages),2013,3,b,D,D
0500000US29055,29055,"Crawford County, Missouri",7225,Restaurants and other eating places,2013,35,362,924,4510
0500000US29055,29055,"Crawford County, Missouri",72251,Restaurants and other eating places,2013,35,362,924,4510
0500000US29055,29055,"Crawford County, Missouri",722511,Full-service restaurants,2013,21,225,600,2667
0500000US29055,29055,"Crawford County, Missouri",722513,Limited-service restaurants,2013,11,135,323,1682
0500000US29055,29055,"Crawford County, Missouri",722515,Snack and nonalcoholic beverage bars,2013,3,a,D,D
0500000US29055,29055,"Crawford County, Missouri",81,Other services (except public administration),2013,48,167,675,2930
0500000US29055,29055,"Crawford County, Missouri",811,Repair and maintenance,2013,17,73,397,1803
0500000US29055,29055,"Crawford County, Missouri",8111,Automotive repair and maintenance,2013,13,63,338,1538
0500000US29055,29055,"Crawford County, Missouri",81111,Automotive mechanical and electrical repair and maintenance,2013,5,22,106,520
0500000US29055,29055,"Crawford County, Missouri",811111,General automotive repair,2013,4,b,99,491
0500000US29055,29055,"Crawford County, Missouri",811112,Automotive exhaust system repair,2013,1,a,D,D
0500000US29055,29055,"Crawford County, Missouri",81112,"Automotive body, paint, interior, and glass repair",2013,6,a,120,544
0500000US29055,29055,"Crawford County, Missouri",811121,"Automotive body, paint, and interior repair and maintenance",2013,6,a,120,544
0500000US29055,29055,"Crawford County, Missouri",81119,Other automotive repair and maintenance,2013,2,b,D,D
0500000US29055,29055,"Crawford County, Missouri",811192,Car washes,2013,2,b,D,D
0500000US29055,29055,"Crawford County, Missouri",8113,Commercial and industrial machinery and equipment (except automotive and electronic) repair and maintenance,2013,3,a,S,221
0500000US29055,29055,"Crawford County, Missouri",81131,Commercial and industrial machinery and equipment (except automotive and electronic) repair and maintenance,2013,3,a,S,221
0500000US29055,29055,"Crawford County, Missouri",811310,Commercial and industrial machinery and equipment (except automotive and electronic) repair and maintenance,2013,3,a,S,221
0500000US29055,29055,"Crawford County, Missouri",8114,Personal and household goods repair and maintenance,2013,1,a,D,D
0500000US29055,29055,"Crawford County, Missouri",81141,Home and garden equipment and appliance repair and maintenance,2013,1,a,D,D
0500000US29055,29055,"Crawford County, Missouri",811412,Appliance repair and maintenance,2013,1,a,D,D
0500000US29055,29055,"Crawford County, Missouri",812,Personal and laundry services,2013,5,a,D,D
0500000US29055,29055,"Crawford County, Missouri",8121,Personal care services,2013,1,a,D,D
0500000US29055,29055,"Crawford County, Missouri",81211,"Hair, nail, and skin care services",2013,1,a,D,D
0500000US29055,29055,"Crawford County, Missouri",812112,Beauty salons,2013,1,a,D,D
0500000US29055,29055,"Crawford County, Missouri",8122,Death care services,2013,4,a,D,D
0500000US29055,29055,"Crawford County, Missouri",81221,Funeral homes and funeral services,2013,3,a,D,D
0500000US29055,29055,"Crawford County, Missouri",812210,Funeral homes and funeral services,2013,3,a,D,D
0500000US29055,29055,"Crawford County, Missouri",81222,Cemeteries and crematories,2013,1,a,D,D
0500000US29055,29055,"Crawford County, Missouri",812220,Cemeteries and crematories,2013,1,a,D,D
0500000US29055,29055,"Crawford County, Missouri",813,"Religious, grantmaking, civic, professional, and similar organizations",2013,26,79,243,1005
0500000US29055,29055,"Crawford County, Missouri",8131,Religious organizations,2013,23,62,200,802
0500000US29055,29055,"Crawford County, Missouri",81311,Religious organizations,2013,23,62,200,802
0500000US29055,29055,"Crawford County, Missouri",813110,Religious organizations,2013,23,62,200,802
0500000US29055,29055,"Crawford County, Missouri",8134,Civic and social organizations,2013,2,a,D,D
0500000US29055,29055,"Crawford County, Missouri",81341,Civic and social organizations,2013,2,a,D,D
0500000US29055,29055,"Crawford County, Missouri",813410,Civic and social organizations,2013,2,a,D,D
0500000US29055,29055,"Crawford County, Missouri",8139,"Business, professional, labor, political, and similar organizations",2013,1,a,D,D
0500000US29055,29055,"Crawford County, Missouri",81399,"Other similar organizations (except business, professional, labor, and political organizations)",2013,1,a,D,D
0500000US29055,29055,"Crawford County, Missouri",813990,"Other similar organizations (except business, professional, labor, and political organizations)",2013,1,a,D,D
0500000US29055,29055,"Crawford County, Missouri",99,Industries not classified,2013,4,a,D,D
